candidate_id,full_name,email,phone,location,resume_raw,resume_parsed,parsed_at,created_at,updated_at
1,Andrew Cox,brenthutchinson@gmail.com,+1-371-223-5577x72947,"South Brian, Vanuatu",Andrew Cox's resume content...,"{""skills"": [""Java"", ""C++"", ""SQL""], ""education"": [""Ph.D. in Data Science"", ""M.Sc. in Software Engineering""], ""experience"": [""DevOps Engineer at TUV Co (3 yrs)""]}",2025-01-25 04:44:40,2025-01-22 04:44:40,2025-01-27 04:44:40
2,Andrew Mathis,audrey00@hotmail.com,(863)036-0748x71127,"North Christopher, Suriname",Andrew Mathis's resume content...,"{""skills"": [""Kubernetes"", ""Java"", ""JavaScript"", ""SQL""], ""education"": [""B.Sc. in Computer Science"", ""B.A. in English""], ""experience"": [""DevOps Engineer at TUV Co (3 yrs)"", ""Software Engineer at ABC Corp (3 yrs)""]}",2025-04-26 19:49:56,2025-04-21 19:49:56,2025-04-23 19:49:56
3,Keith Aguilar,scott83@hotmail.com,320.850.9331x645,"Hallstad, Canada",Keith Aguilar's resume content...,"{""skills"": [""Communication"", ""Docker"", ""SQL""], ""education"": [""B.Sc. in Computer Science""], ""experience"": [""Software Engineer at ABC Corp (3 yrs)"", ""DevOps Engineer at TUV Co (3 yrs)""]}",2024-12-13 05:25:50,2024-12-12 05:25:50,2024-12-13 05:25:50
4,Johnny Wise,tuckersandra@yahoo.com,001-882-534-0082x386,"Bakerburgh, Pakistan",Johnny Wise's resume content...,"{""skills"": [""C++"", ""Leadership"", ""Docker"", ""AWS"", ""SQL""], ""education"": [""B.A. in English"", ""B.Sc. in Computer Science""], ""experience"": [""Software Engineer at ABC Corp (3 yrs)"", ""DevOps Engineer at TUV Co (3 yrs)""]}",2025-06-21 16:57:46,2025-06-20 16:57:46,2025-06-23 16:57:46
5,Corey Crawford,xbrandt@edwards.com,419-665-0701x40587,"North Tyler, Macao",Corey Crawford's resume content...,"{""skills"": [""Docker"", ""Leadership"", ""C++""], ""education"": [""MBA"", ""B.A. in English""], ""experience"": [""Data Analyst at XYZ Inc (2 yrs)"", ""DevOps Engineer at TUV Co (3 yrs)""]}",2025-06-11 01:09:25,2025-06-10 01:09:25,2025-06-13 01:09:25
